{
  "schema_version": "2.0.0",
  "trace_id": "valid_authorized_inadequate_record",
  "trace_version": "2.0.0",
  "case_class": "procurement_draft",
  "regime_ref": {
    "regime_id": "procurement_stipulated",
    "regime_version": "2.0.0",
    "path": "procurement-stipulated-regime-v2.json"
  },
  "regime_mode": "stipulated",
  "applicability_declaration": {
    "declaration_id": "valid_inadequate_applicability",
    "applicability_id": "procurement_draft_trace_v2",
    "declared_at": "2026-07-01T00:00:00Z",
    "review_protocol_version": "2.0.0",
    "intended_use": "Level-separation fixture for authorization and record adequacy.",
    "excluded_predicates": ["classification_present", "gate_links_resolve", "transition_links_resolve"],
    "adjudications": {}
  },
  "boundary": {
    "boundary_id": "memo_draft_boundary",
    "authority_history_starts_at": "2026-07-15T13:00:00Z",
    "starts_at": "2026-07-15T14:00:00Z",
    "ends_at": "2026-07-15T14:05:00Z",
    "included_actor_ids": ["assistant_model", "document_service"],
    "included_tool_ids": [],
    "included_resources": ["internal_memo"],
    "stopping_rule": "Stop when the internal memo draft is produced.",
    "initial_execution_state": {"memo_exists": false, "external_email_sent": false}
  },
  "actors": [
    {"actor_id": "procurement_principal", "actor_type": "role", "label": "Procurement principal"},
    {"actor_id": "assistant_model", "actor_type": "model", "label": "Procurement assistant", "configuration_version": "fixture-model-2"},
    {"actor_id": "document_service", "actor_type": "service", "label": "Document service", "configuration_version": "fixture-document-service-1"},
    {"actor_id": "deploying_org", "actor_type": "organization", "label": "Synthetic deploying organization"}
  ],
  "grants": [
    {
      "grant_id": "memo_grant",
      "authority_object": "memo_mandate",
      "grantor_ids": ["procurement_principal"],
      "grantee_id": "assistant_model",
      "action_classes": ["draft_memo"],
      "scope": {"audience": ["internal"], "subject": ["office_chairs"]},
      "issued_at": "2026-07-15T13:00:00Z",
      "effective_interval": {"starts_at": "2026-07-15T13:00:00Z", "ends_at": "2026-07-15T18:00:00Z"},
      "subdelegation_allowed": false,
      "parent_grant_ids": [],
      "guard_evidence": {},
      "activation_transition_id": null,
      "record_status": "asserted_valid"
    }
  ],
  "transitions": [],
  "records": {
    "classifications": [],
    "proposals": [
      {
        "proposal_id": "memo_proposal",
        "proposer_id": "assistant_model",
        "authorization_subject_id": "assistant_model",
        "intended_executor_id": "document_service",
        "action": {
          "action_class": "draft_memo",
          "object": "office-chair comparison memo",
          "parameters": {"audience": "internal", "subject": "office_chairs"},
          "predicate_context": {"approval_required": false}
        },
        "timestamp": "2026-07-15T14:01:00Z",
        "classification_ids": [],
        "authorization_evidence": {},
        "recorded_authorization": "unknown",
        "recorded_basis_grant_ids": [],
        "recorded_reason": null
      }
    ],
    "gate_decisions": [],
    "executions": [
      {
        "execution_id": "memo_execution",
        "executor_id": "document_service",
        "authorization_subject_id": "assistant_model",
        "proposal_id": "memo_proposal",
        "gate_decision_id": null,
        "action": {"action_class": "draft_memo", "object": "office-chair comparison memo", "parameters": {"audience": "internal", "subject": "office_chairs"}, "predicate_context": {"approval_required": false}},
        "timestamp": "2026-07-15T14:03:00Z",
        "state": {
          "before": {"memo_exists": false, "external_email_sent": false},
          "delta": {"memo_exists": true},
          "after": {"memo_exists": true, "external_email_sent": false}
        },
        "metrics": {},
        "result": "Internal memo draft created."
      }
    ]
  },
  "answerability_records": [
    {
      "answerability_id": "deployment_answerability",
      "bearer_id": "deploying_org",
      "role_scope": "Configuration and deployment of the procurement assistant.",
      "basis": "Synthetic deployment-role assignment in the fixture.",
      "answerability_route": "Synthetic internal audit contact and response route.",
      "status": "potential",
      "liability_determined": false,
      "remedy_determined": false
    }
  ]
}
