{
  "schema_version": "2.0.0",
  "trace_id": "ineffective_override_valid_release",
  "trace_version": "2.0.0",
  "case_class": "temporal_authority",
  "regime_ref": {"regime_id": "procurement_stipulated", "regime_version": "2.0.0", "path": "procurement-stipulated-regime-v2.json"},
  "regime_mode": "stipulated",
  "applicability_declaration": {
    "declaration_id": "override_release_applicability",
    "applicability_id": "temporal_authority_trace_v2",
    "declared_at": "2026-07-01T00:00:00Z",
    "review_protocol_version": "2.0.0",
    "intended_use": "Temporal-authority fixture separating an ineffective unilateral override from a valid guarded release.",
    "excluded_predicates": ["classification_present", "gate_links_resolve"],
    "adjudications": {}
  },
  "boundary": {
    "boundary_id": "override_release_boundary",
    "authority_history_starts_at": "2026-07-21T13:00:00Z",
    "starts_at": "2026-07-21T14:00:00Z",
    "ends_at": "2026-07-21T14:15:00Z",
    "included_actor_ids": ["assistant_model", "document_service"],
    "included_tool_ids": [],
    "included_resources": ["protected_mandate", "internal_memo"],
    "stopping_rule": "Stop after the post-release memo is produced.",
    "initial_execution_state": {"memo_exists": false, "external_email_sent": false}
  },
  "actors": [
    {"actor_id": "procurement_principal", "actor_type": "role", "label": "Procurement principal"},
    {"actor_id": "compliance_officer", "actor_type": "role", "label": "Compliance officer"},
    {"actor_id": "assistant_model", "actor_type": "model", "label": "Procurement assistant", "configuration_version": "fixture-model-2"},
    {"actor_id": "document_service", "actor_type": "service", "label": "Document service", "configuration_version": "fixture-document-service-1"},
    {"actor_id": "deploying_org", "actor_type": "organization", "label": "Synthetic deploying organization"},
    {"actor_id": "responsible_officer", "actor_type": "person", "label": "Synthetic responsible officer"}
  ],
  "grants": [
    {
      "grant_id": "released_memo_grant",
      "authority_object": "protected_mandate",
      "grantor_ids": ["procurement_principal"],
      "grantee_id": "assistant_model",
      "action_classes": ["draft_memo"],
      "scope": {"audience": ["internal"], "subject": ["office_chairs"]},
      "issued_at": "2026-07-21T13:00:00Z",
      "effective_interval": {"starts_at": "2026-07-21T13:00:00Z", "ends_at": "2026-07-21T18:00:00Z"},
      "subdelegation_allowed": false,
      "parent_grant_ids": [],
      "guard_evidence": {},
      "activation_transition_id": "valid_release",
      "record_status": "asserted_valid"
    }
  ],
  "transitions": [
    {
      "transition_id": "unilateral_override",
      "issuer_ids": ["procurement_principal"],
      "operation": "override",
      "authority_object": "protected_mandate",
      "normative_payload": {"state": "ordinary"},
      "timestamp": "2026-07-21T14:01:00Z",
      "basis_grant_ids": [],
      "guard_evidence": {"compliance_review_complete": true},
      "recorded_effect": "asserted_effective"
    },
    {
      "transition_id": "valid_release",
      "issuer_ids": ["compliance_officer"],
      "operation": "release",
      "authority_object": "protected_mandate",
      "normative_payload": {"state": "released"},
      "timestamp": "2026-07-21T14:03:00Z",
      "basis_grant_ids": [],
      "guard_evidence": {"compliance_review_complete": true},
      "recorded_effect": "asserted_effective"
    }
  ],
  "records": {
    "classifications": [],
    "proposals": [
      {
        "proposal_id": "released_memo_proposal",
        "proposer_id": "assistant_model",
        "authorization_subject_id": "assistant_model",
        "intended_executor_id": "document_service",
        "action": {"action_class": "draft_memo", "object": "office-chair comparison memo", "parameters": {"audience": "internal", "subject": "office_chairs"}, "predicate_context": {"protected_mandate_state": "released"}},
        "timestamp": "2026-07-21T14:05:00Z",
        "classification_ids": [],
        "authorization_evidence": {},
        "recorded_authorization": "permitted",
        "recorded_basis_grant_ids": ["released_memo_grant"],
        "recorded_reason": "The guarded release activated the memo grant."
      }
    ],
    "gate_decisions": [],
    "executions": [
      {
        "execution_id": "released_memo_execution",
        "executor_id": "document_service",
        "authorization_subject_id": "assistant_model",
        "proposal_id": "released_memo_proposal",
        "gate_decision_id": null,
        "action": {"action_class": "draft_memo", "object": "office-chair comparison memo", "parameters": {"audience": "internal", "subject": "office_chairs"}, "predicate_context": {"protected_mandate_state": "released"}},
        "timestamp": "2026-07-21T14:07:00Z",
        "state": {"before": {"memo_exists": false, "external_email_sent": false}, "delta": {"memo_exists": true}, "after": {"memo_exists": true, "external_email_sent": false}},
        "metrics": {},
        "result": "The post-release internal memo was produced."
      }
    ]
  },
  "answerability_records": [
    {"answerability_id": "organization_answerability", "bearer_id": "deploying_org", "role_scope": "Deployment and operation of the procurement assistant.", "basis": "Synthetic organizational deployment role.", "answerability_route": "Synthetic organizational contact and response route.", "status": "potential", "liability_determined": false, "remedy_determined": false},
    {"answerability_id": "officer_answerability", "bearer_id": "responsible_officer", "role_scope": "Approval and monitoring role recorded for the deployment.", "basis": "Synthetic role assignment; no liability conclusion follows.", "answerability_route": "Synthetic officer contact and response route.", "status": "potential", "liability_determined": false, "remedy_determined": false}
  ]
}
